{
  "$schema": "https://json-schema.org/draft/2020-12/schema",
  "$id": "urn:oasis:names:specification:ubl:schema:json:TransportServiceDescriptionRequest-2",
  "description": "A document requesting a Transport Service Description, sent from a party with a transport demand (transport user) to a party providing transport services (transport service provider).",
  "type": "object",
  "properties": {
    "UBLEntity": {
      "const": "urn:oasis:names:specification:ubl:schema:json:TransportServiceDescriptionRequest-2",
      "description": "Identifies the JSON schema governing this instance."
    },
    "UBLExtensions": {
      "$ref": "urn:oasis:names:specification:ubl:schema:json:CommonExtensionComponents-2#/$defs/UBLExtensionsType"
    },
    "Signature": {
      "oneOf": [
        {
          "$ref": "urn:oasis:names:specification:ubl:schema:json:CommonAggregateComponents-2#/$defs/SignatureType"
        },
        {
          "type": "array",
          "items": {
            "$ref": "urn:oasis:names:specification:ubl:schema:json:CommonAggregateComponents-2#/$defs/SignatureType"
          }
        }
      ]
    },
    "UBLVersionID": {
      "$ref": "urn:oasis:names:specification:ubl:schema:json:CommonBasicComponents-2#/$defs/UBLVersionID"
    },
    "CustomizationID": {
      "$ref": "urn:oasis:names:specification:ubl:schema:json:CommonBasicComponents-2#/$defs/CustomizationID"
    },
    "ProfileID": {
      "$ref": "urn:oasis:names:specification:ubl:schema:json:CommonBasicComponents-2#/$defs/ProfileID"
    },
    "ProfileExecutionID": {
      "$ref": "urn:oasis:names:specification:ubl:schema:json:CommonBasicComponents-2#/$defs/ProfileExecutionID"
    },
    "ID": {
      "$ref": "urn:oasis:names:specification:ubl:schema:json:CommonBasicComponents-2#/$defs/ID"
    },
    "UUID": {
      "$ref": "urn:oasis:names:specification:ubl:schema:json:CommonBasicComponents-2#/$defs/UUID"
    },
    "IssueDate": {
      "$ref": "urn:oasis:names:specification:ubl:schema:json:CommonBasicComponents-2#/$defs/IssueDate"
    },
    "IssueTime": {
      "$ref": "urn:oasis:names:specification:ubl:schema:json:CommonBasicComponents-2#/$defs/IssueTime"
    },
    "Note": {
      "oneOf": [
        {
          "$ref": "urn:oasis:names:specification:ubl:schema:json:CommonBasicComponents-2#/$defs/Note"
        },
        {
          "type": "array",
          "items": {
            "$ref": "urn:oasis:names:specification:ubl:schema:json:CommonBasicComponents-2#/$defs/Note"
          }
        }
      ]
    },
    "ServiceInformationPreferenceCode": {
      "$ref": "urn:oasis:names:specification:ubl:schema:json:CommonBasicComponents-2#/$defs/ServiceInformationPreferenceCode"
    },
    "SenderParty": {
      "$ref": "urn:oasis:names:specification:ubl:schema:json:CommonAggregateComponents-2#/$defs/PartyType"
    },
    "ReceiverParty": {
      "$ref": "urn:oasis:names:specification:ubl:schema:json:CommonAggregateComponents-2#/$defs/PartyType"
    },
    "TransportServiceProviderParty": {
      "$ref": "urn:oasis:names:specification:ubl:schema:json:CommonAggregateComponents-2#/$defs/PartyType"
    },
    "TransportationService": {
      "oneOf": [
        {
          "$ref": "urn:oasis:names:specification:ubl:schema:json:CommonAggregateComponents-2#/$defs/TransportationServiceType"
        },
        {
          "type": "array",
          "items": {
            "$ref": "urn:oasis:names:specification:ubl:schema:json:CommonAggregateComponents-2#/$defs/TransportationServiceType"
          },
          "minItems": 1
        }
      ]
    }
  },
  "required": [
    "UBLEntity",
    "ID",
    "IssueDate",
    "IssueTime",
    "TransportationService"
  ],
  "additionalProperties": false,
  "minProperties": 1,
  "title": "Transport Service Description Request. Details"
}
